{
  "claim_boundary": {
    "causal_product_effects_supported": false,
    "github_population_estimates_supported": false,
    "independent_confirmatory_test_supported": false,
    "interpretation": "Results describe only the fixed, pilot-informed repository panel, 90-day period, provider-visible formal review objects, and frozen definitions. A missing force-push event means only not observed in the captured timeline; it does not prove an ordinary append-only push.",
    "issue_recall_or_semantic_safety_supported": false,
    "market_size_estimates_supported": false,
    "ordinary_push_identification_supported": false,
    "panel_period_descriptive_estimates_supported": true,
    "reviewer_time_savings_supported": false,
    "willingness_to_pay_supported": false
  },
  "collection": {
    "capture_failures": 0,
    "captured_at": "2026-09-05T12:22:50Z",
    "classified_pull_requests": 500,
    "selected_pull_requests": 500,
    "status": "complete"
  },
  "dataset_version": "1.0.0",
  "gates": {
    "all_global_gates_passed": true,
    "capture_failures_within_limit": true,
    "checkpoint_oid_observability_basis_points": 9959,
    "collection_complete": true,
    "maximum_capture_failures": 0,
    "minimum_checkpoint_oid_observability_met": true,
    "minimum_completed_reviewed_pull_requests_met": true,
    "minimum_repositories_at_target_met": true,
    "minimum_sampled_pull_requests_met": true,
    "repositories_at_target": 10,
    "required_checkpoint_oid_observability_basis_points": 9000,
    "required_completed_reviewed_pull_requests": 200,
    "required_repositories_at_target": 8,
    "required_sampled_pull_requests": 400
  },
  "generated_at": "2026-09-05T12:34:00Z",
  "manifest_sha256": "d3cd40040523d5f8ee024efc6f4318937f056665ac714010188e29be76f536c6",
  "metrics": [
    {
      "basis_points": 8520,
      "by_repository": [
        {
          "basis_points": 10000,
          "denominator": 50,
          "numerator": 50,
          "repository": "dotnet/runtime",
          "status": "defined",
          "wilson_95_lower_basis_points": 9286,
          "wilson_95_upper_basis_points": 10000
        },
        {
          "basis_points": 7400,
          "denominator": 50,
          "numerator": 37,
          "repository": "elastic/elasticsearch",
          "status": "defined",
          "wilson_95_lower_basis_points": 6044,
          "wilson_95_upper_basis_points": 8413
        },
        {
          "basis_points": 10000,
          "denominator": 50,
          "numerator": 50,
          "repository": "github/gh-stack",
          "status": "defined",
          "wilson_95_lower_basis_points": 9286,
          "wilson_95_upper_basis_points": 10000
        },
        {
          "basis_points": 10000,
          "denominator": 50,
          "numerator": 50,
          "repository": "grafana/grafana",
          "status": "defined",
          "wilson_95_lower_basis_points": 9286,
          "wilson_95_upper_basis_points": 10000
        },
        {
          "basis_points": 10000,
          "denominator": 50,
          "numerator": 50,
          "repository": "home-assistant/core",
          "status": "defined",
          "wilson_95_lower_basis_points": 9286,
          "wilson_95_upper_basis_points": 10000
        },
        {
          "basis_points": 7400,
          "denominator": 50,
          "numerator": 37,
          "repository": "kubernetes/kubernetes",
          "status": "defined",
          "wilson_95_lower_basis_points": 6044,
          "wilson_95_upper_basis_points": 8413
        },
        {
          "basis_points": 10000,
          "denominator": 50,
          "numerator": 50,
          "repository": "microsoft/vscode",
          "status": "defined",
          "wilson_95_lower_basis_points": 9286,
          "wilson_95_upper_basis_points": 10000
        },
        {
          "basis_points": 5000,
          "denominator": 50,
          "numerator": 25,
          "repository": "PostHog/posthog",
          "status": "defined",
          "wilson_95_lower_basis_points": 3664,
          "wilson_95_upper_basis_points": 6336
        },
        {
          "basis_points": 5400,
          "denominator": 50,
          "numerator": 27,
          "repository": "rust-lang/rust",
          "status": "defined",
          "wilson_95_lower_basis_points": 4039,
          "wilson_95_upper_basis_points": 6704
        },
        {
          "basis_points": 10000,
          "denominator": 50,
          "numerator": 50,
          "repository": "vercel/next.js",
          "status": "defined",
          "wilson_95_lower_basis_points": 9286,
          "wilson_95_upper_basis_points": 10000
        }
      ],
      "denominator": 500,
      "id": "formal_peer_reviewed_pr_rate",
      "minimum_denominator": 100,
      "minimum_denominator_met": true,
      "numerator": 426,
      "repository_median_basis_points": 10000,
      "status": "defined",
      "wilson_95_lower_basis_points": 8181,
      "wilson_95_upper_basis_points": 8805
    },
    {
      "basis_points": 8060,
      "by_repository": [
        {
          "basis_points": 10000,
          "denominator": 50,
          "numerator": 50,
          "repository": "dotnet/runtime",
          "status": "defined",
          "wilson_95_lower_basis_points": 9286,
          "wilson_95_upper_basis_points": 10000
        },
        {
          "basis_points": 7400,
          "denominator": 50,
          "numerator": 37,
          "repository": "elastic/elasticsearch",
          "status": "defined",
          "wilson_95_lower_basis_points": 6044,
          "wilson_95_upper_basis_points": 8413
        },
        {
          "basis_points": 10000,
          "denominator": 50,
          "numerator": 50,
          "repository": "github/gh-stack",
          "status": "defined",
          "wilson_95_lower_basis_points": 9286,
          "wilson_95_upper_basis_points": 10000
        },
        {
          "basis_points": 10000,
          "denominator": 50,
          "numerator": 50,
          "repository": "grafana/grafana",
          "status": "defined",
          "wilson_95_lower_basis_points": 9286,
          "wilson_95_upper_basis_points": 10000
        },
        {
          "basis_points": 10000,
          "denominator": 50,
          "numerator": 50,
          "repository": "home-assistant/core",
          "status": "defined",
          "wilson_95_lower_basis_points": 9286,
          "wilson_95_upper_basis_points": 10000
        },
        {
          "basis_points": 4400,
          "denominator": 50,
          "numerator": 22,
          "repository": "kubernetes/kubernetes",
          "status": "defined",
          "wilson_95_lower_basis_points": 3116,
          "wilson_95_upper_basis_points": 5770
        },
        {
          "basis_points": 10000,
          "denominator": 50,
          "numerator": 50,
          "repository": "microsoft/vscode",
          "status": "defined",
          "wilson_95_lower_basis_points": 9286,
          "wilson_95_upper_basis_points": 10000
        },
        {
          "basis_points": 5000,
          "denominator": 50,
          "numerator": 25,
          "repository": "PostHog/posthog",
          "status": "defined",
          "wilson_95_lower_basis_points": 3664,
          "wilson_95_upper_basis_points": 6336
        },
        {
          "basis_points": 3800,
          "denominator": 50,
          "numerator": 19,
          "repository": "rust-lang/rust",
          "status": "defined",
          "wilson_95_lower_basis_points": 2586,
          "wilson_95_upper_basis_points": 5185
        },
        {
          "basis_points": 10000,
          "denominator": 50,
          "numerator": 50,
          "repository": "vercel/next.js",
          "status": "defined",
          "wilson_95_lower_basis_points": 9286,
          "wilson_95_upper_basis_points": 10000
        }
      ],
      "denominator": 500,
      "id": "completed_review_pr_rate",
      "minimum_denominator": 100,
      "minimum_denominator_met": true,
      "numerator": 403,
      "repository_median_basis_points": 10000,
      "status": "defined",
      "wilson_95_lower_basis_points": 7690,
      "wilson_95_upper_basis_points": 8383
    },
    {
      "basis_points": 9959,
      "by_repository": [
        {
          "basis_points": 10000,
          "denominator": 71,
          "numerator": 71,
          "repository": "dotnet/runtime",
          "status": "defined",
          "wilson_95_lower_basis_points": 9486,
          "wilson_95_upper_basis_points": 10000
        },
        {
          "basis_points": 10000,
          "denominator": 44,
          "numerator": 44,
          "repository": "elastic/elasticsearch",
          "status": "defined",
          "wilson_95_lower_basis_points": 9197,
          "wilson_95_upper_basis_points": 10000
        },
        {
          "basis_points": 10000,
          "denominator": 58,
          "numerator": 58,
          "repository": "github/gh-stack",
          "status": "defined",
          "wilson_95_lower_basis_points": 9378,
          "wilson_95_upper_basis_points": 10000
        },
        {
          "basis_points": 10000,
          "denominator": 61,
          "numerator": 61,
          "repository": "grafana/grafana",
          "status": "defined",
          "wilson_95_lower_basis_points": 9407,
          "wilson_95_upper_basis_points": 10000
        },
        {
          "basis_points": 10000,
          "denominator": 58,
          "numerator": 58,
          "repository": "home-assistant/core",
          "status": "defined",
          "wilson_95_lower_basis_points": 9378,
          "wilson_95_upper_basis_points": 10000
        },
        {
          "basis_points": 10000,
          "denominator": 22,
          "numerator": 22,
          "repository": "kubernetes/kubernetes",
          "status": "defined",
          "wilson_95_lower_basis_points": 8513,
          "wilson_95_upper_basis_points": 10000
        },
        {